"8174063","ascetic","(adj.) someone who practices self denial as a spiritual discipline","Want to live an ascetic lifestyle? Then you better ditch the flat panel TV and fuzzy slippers. To be ascetic, you learn to live without; it's all about self-denial."
"8174064","desiccate","(v.) lacking vitality or spirit; lifeless","The verb desiccate means to dry out, dry up and dehydrate. It's helpful to desiccate weeds but certainly not crops."
"8174065","erudite","(adj.) having or showing profound knowledge","If you call someone erudite, that means they show great learning. After you've earned your second Ph.D., you will be truly erudite."
"8174066","incorporate","(v.) make into a whole or make part of a whole","The future tests are likely to incorporate surcharges on the biggest banks because of their systemic importance."
"8174067","officious","(adj.) intrusive in a meddling or offensive manner","Though officious sounds like official, it means being annoyingly eager to do more than is required. ""The officious lunch lady made everyone's food choices her business, and made nasty comments when students chose cookies over carrots."""
"8174068","assiduous","(adj.) marked by care and persistent effort","Such expertise comes not from luck but from thousands of hours of assiduous effort."
"8174069","desultory","(adj.) marked by lack of definite plan or regularity or purpose","The best news from this desultory referendum campaign is that Brown’s video has gone viral."
"8174070","esoteric","(adj.) understandable only by an enlightened inner circle","The quantum theory is not just an esoteric addendum."
"8174071","indeterminate","(adj.) not fixed or known in advance","When someone contracts a rare stomach parasite but has not been traveling internationally, you might say it had indeterminate origins."
"8174072","onerous","(adj.) very difficult to deal with or do; wearing","But if all of your teachers do it, that makes the task of completing your homework an onerous one, to say the least."
"8174073","assuage","(v.) provide physical relief, as from pain","Assuaging your hunger by eating a bag of marshmallows may cause you other unpleasant feelings."
"8174074","deterrent","(n.) something immaterial that interferes with action or progress","Let's say there's a giant pile of cookies being guarded by an angry dog — the dog is a deterrent."
"8174075","eulogy","(n.) a formal expression of praise for someone who has died","A year ago this month, President Obama was delivering a eulogy in Charleston, S.C., after the mass shooting in a church there."
"8174076","indigence","(n.) a state of extreme poverty or destitution","If you experience indigence, you have a critical need for food, money, and other resources."
"8174077","opprobrium","(n.) a state of extreme dishonor","If you throw a soft drink off the theater balcony, the opprobrium might keep you from getting dates to the movies."
"8174078","attenuate","(v.) become weaker, in strength, value, or magnitude","The effects of aging may be attenuated by exercise (or by drinking from the fountain of youth)."
"8174079","diatribe","(n.) thunderous verbal attack","
It's pretty overwhelming when you ask your friend a seemingly innocuous question, like ""Do you like hot dogs?"" and she unleashes a diatribe about the evils of eating meat. "
"8174080","euphemism","(n.) an inoffensive expression substituted for an offensive one","There’s a euphemism that many in the gaming community use to describe the sometimes intense emotions around gaming: “Passion.”"
"8174081","indolent","(adj.) disinclined to work or exertion","It can take an indolent teenager hours to get out of bed on a weekend morning. Often it's noon before he finally comes shuffling down to breakfast in his pajamas."
"8174082","oscillate","(v.) move or swing from side to side regularly","On a hot day, you’ll be happy to have a fan that can oscillate, meaning it moves back and forth in a steady motion."
"8174083","audacious","(adj.) disposed to venture or take risks","This adjective is very bold — if you are audacious, you are daring and unconventional!"
"8174084","dichotomy","(n.) being twofold","A dichotomy is an idea or classification split in two. When you point out a dichotomy, you draw a clear distinction between two things."
"8174085","exacerbate","(v.) make worse","If you're in trouble, complaining about it will only exacerbate the problem."
"8174086","inert","(adj.) unable to move or resist motion","In most cases, the final polyethylenes are inert and stubbornly resistant to breakdown."
"8174087","ostentatious","(adj.) intended to attract notice and impress others","The decor reflects the ostentatious style which was fashionable at the time, a mishmash of Neoclassicism and late Renaissance."
"8174088","austere","(adj.) of a stern or strict bearing or demeanor","In the evenings, as the sun set and the shooting let up, Nott taught his course on surgery in austere environments."
"8174089","diffidence","(n.) lack of self-confidence","Your diffidence might be the reason why you never say ""hi"" to the cute guy or gal in the elevator or why you never ask for a raise."
"8174090","exculpate","(v.) pronounce not guilty of criminal charges","If you've been wrongly accused of robbery, you'd better hope a judge will exculpate you, unless you want to go to jail because you've heard prison food is amazing."
"8174091","pate","(n.) liver or meat or fowl finely minced or ground and variously seasoned","Pate (the food!) is sometimes served with bread or crackers."
"8174092","ingenuous","(adj.) lacking in sophistication or worldliness","One of the things kindergarten teachers value is the chance to work with kids while they're still relatively ingenuous––their open, trusting natures are a joy."
"8174093","paragon","(adj.) a perfect embodiment of a concept","The downtown area is a paragon for urban renewal, the locals are proud and hospitable, and, most importantly, the city boasts a kick-ass beer scene."
"8174094","autonomous","(adj.) a perfect embodiment of a concept","Once you move out of your parents' house and get your own job, you will be an autonomous member of the family."
"8174095","diffuse","(adj.) spread out; not concentrated in one place","If lots of people in school believe invisible angels are everywhere, you could say that opinion is diffuse."
"8174096","exigency","(n.) a pressing or urgent situation","Many patients struggle in their role as women, something that has taken on a particular exigency because of drastic changes in gender dynamics."
"8174097","inherent","(adj.) existing as an essential constituent or characteristic","Anticipating how much our tastes will change is hard because we cannot see past our inherent resistance to the unfamiliar."
"8174098","partisan","(adj.) a fervent and even militant proponent of something","
If something is prejudicial towards a particular point of view, you can call it partisan. You'll often hear of the partisan politics in the U.S.— since politicians seem to be completely devoted to the agendas of their own parties."
"8174099","aver","(v.) to declare or affirm solemnly and formally as true","Ultimately, they aver, neuroscience can indeed change our minds — but social and political understanding of the issues must be factored in."
"8174100","digression","(n.) a turning aside","When your essay about French cooking starts describing a childhood trip to Disneyland, it's taken a digression — it's strayed from the main topic."
"8174101","extrapolation","(n.) an inference about the future based on known facts","His extrapolation of broad support among minorities appears to be based on one of two cases of violence by minorities against his protesters."
"8174102","innocuous","(adj.) not injurious to physical or mental health","Public figures like mayors and governors have to expect they'll get critical or even hurtful emails and phone calls, as well as more innocuous feedback."
"8174103","pathological","(adj.) relating to the study of diseases","There is a pathological gambling addiction so that no matter what he thought at the end of the day, he bet it all."
"8174104","banal","(adj.) repeated too often; overfamiliar through overuse","And his life is just one painfully banal blow after another."
"8174105","dirge","(n.) As you might imagine, a dirge is usually quite sad. Another word with a similar meaning that you might know is “requiem.”","Many cultures have linked weddings with death, often in the form of a bridal dirge about saying farewell to the family."
"8174106","facetious","(adj.) cleverly amusing in tone","Back in the 1920s, the writer Karel Capek said Cesko was “not musical”; for foreigners “it even sounds a little facetious.”"
"8174107","insensible","(adj.) barely able to be perceived","The adjective insensible is used to describe someone who is unconscious. If you keep your bowling ball on the top shelf of the closet and it rolls out and conks you on the head, you will be probably rendered insensible."
"8174108","paucity","(n.) an insufficient quantity or number","Given the relative paucity of hotels in the area, many England fans are expected to stay in Lille — a bigger city about 25 miles away."
"8174109","belie","(v.) be in contradiction with","If you are 93 but look like you are 53, then your young looks belie your age."
"8174110","disabuse","(v.) free somebody from an erroneous belief","Many teachers of health find that when they teach, they spend as much energy disabusing kids of false beliefs as they do giving them the facts."
"8174111","facilitate","(v.) make easier","If your best friend is very shy, you could facilitate her efforts to meet new people."
"8174112","insinuate","(v.) suggest in an indirect or covert way; give to understand","He insinuated that Muslim Americans, like Mexican Americans, were disloyal."
"8174113","pedantic","(adj.) marked by a narrow focus on or display of learning","Part of what keeps the sorority girls’ feminist teachings from ever feeling pedantic is that they’re not aimed, at least directly, at the audience."
"8174114","beneficent","(adj.) doing or producing good","If you're a beneficent person, you probably spend a lot of your time volunteering at soup kitchens or homeless shelters, helping people who are less fortunate than you are."
"8174115","discerning","(adj.) having or revealing keen insight and good judgment","Discerning people pick up on subtle traits and are good judges of quality — they're the ones that can tell if your cupcakes are homemade from the finest ingredients or totally from a box mix."
"8174116","fallacious","(adj.) containing or based on incorrect reasoning","Something fallacious is a mistake that comes from too little information or unsound sources.  Predictions that the whole state of California will snap off from the rest of North America and float away have proven to be fallacious — for now, anyway.
"
"8174117","insipid","(adj.) lacking in flavor or interest","Something insipid is lacking in flavor or interest."
"8174118","penchant","(n.) a strong liking","If you have a penchant for hot pot, you either eat it daily, or wish you did."
"8174119","bolster","(v.) support and strengthen","When you cheer up a friend who's feeling down, you bolster them."
"8174120","discordant","(adj.) not in agreement or harmony","If you believe that movies should entertain, but your friend insists that movies should inspire, then the two of you hold discordant views on the purpose of movies."
"8174121","fatuous","(adj.) devoid of intelligence","In response, the board majority and its industry overlords have offered some of the most fatuous defenses heard from a public body in years."
"8174122","insularity","(n.) the state of being isolated or detached","For centuries, Britain has been a sort of diluted Japan: an island on the edge of a great continental mass, proud of its insularity."
"8174123","penury","(n.) a state of extreme poverty or destitution","Economic downturns, job loss, shopping sprees, and weekends at the high rollers' table in Vegas can lead to penury."
"8174124","bombastic","(adj.) ostentatiously lofty in style","Apple’s political stand against Trump, communicated privately to Republicans, is a sign of the widening schism between Silicon Valley and the GOP’s bombastic presumptive nominee."
"8174125","discredit","(n.) the state of being held in low esteem","“your actions will bring discredit to your name”"
"8174126","fawning","(adj.) attempting to win favor by flattery","WoW is so popular that there are professional players who are treated like movie stars, complete with sponsorship deals with fawning groupies."
"8174127","intractable","(adj.) difficult to manage or mold","Can't manage your stubborn little brother who won't do what anyone says? You could call him intractable."
"8174128","perennial","(adj.) lasting three seasons or more","If you fight with your parents every year over whether they really must invite your annoying cousins for Thanksgiving, you could call that a perennial conflict."
"8174129","boorish","(adj.) ill-mannered and coarse in behavior or appearance","If your cousin tells revolting jokes, belches, and smells like he spent the winter in a cave, he could be described as boorish — an adjective used for people with bad manners and a sloppy appearance."
"8174130","discrepancy","(n.) a difference between conflicting facts or claims or opinions","If there is a discrepancy between the money you earned and the number on your paycheck, you should complain to your boss."
"8174131","felicitous","(adj.) exhibiting an agreeably appropriate manner or style","Felicitous words you write on your friend's birthday card are the ones that perfectly suit the occasion and make her happy when she reads them."
"8174132","intransigence","(n.) stubborn refusal to compromise or change","If you refuse to compromise with your sister about whose turn it is to do the dishes, your mother might accuse you both of intransigence."
"8174133","perfidious","(adj.) tending to betray","My view was that Pakistan was playing a perfidious and dangerous double game and needed to be called on it."
"8174134","burgeon","(n.) grow and flourish","If you have a green thumb, in the spring your flower gardens may burgeon. If you don't have a green thumb, your collection of plastic plants may burgeon."
"8174135","fervor","(n.) feelings of great warmth and intensity","Use fervor to describe an intensity of emotion or expression. Fans of the Los Angeles Dodgers show so much fervor that they ""bleed Dodger blue."""
"8174136","inundate","(v.) fill or cover completely, usually with water","Your bathroom could be inundated with water if the pipes burst, and hopefully your inbox is inundated with nice emails on your birthday."
"8174137","perfunctory","(adj.) hasty and without attention to detail; not thorough","If you give someone a gift and they look at it like it's roadkill and say nothing about it but a perfunctory ""thank you,"" you might not be giving them another one anytime soon."
"8174138","burnish","(v.) polish and make shine","The young man burnishes his Porsche until it seems to gleam with pride."
"8174139","disingenuous","(adj.) not straightforward or candid","“The prime minister has led a very disingenuous campaign on the most crucial question our country will face in my lifetime,” he said."
"8174140","flag","(n.) a rectangular piece of cloth of distinctive design","The coffins were draped in the Bangladeshi flag – a red disc on a green background."
"8174141","permeable","(adj.) allowing fluids or gases to pass or diffuse through","I wish I hadn't worn my permeable sweater to the picnic when the weatherman called for thunderstorms. The rain seeped right through the fabric, soaking me to the skin."
"8174142","buttress","(n.) a support usually of stone or brick (v.)  make stronger or defensible","You may find that giving compliments to everyone you meet buttresses your popularity."
"8174143","disinterested","(adj.) unaffected by concern for one's own welfare","If you can't decide whether to purchase the shirt with orange polka dots or the purple paisley-patterned one, you might seek input from a disinterested, or unbiased, party (who will probably tell you not to buy either one)."
"8174144","fledgling","(n.) young bird that has just fledged or become capable of flying","The Guardian’s Beijing correspondent asks if Britain’s fledgling “golden relationship” with China could be in jeopardy."
"8174145","Invective","(n.) abusive language used to express blame or censure","Invective is harsh, abusive language, like, ""you dirty rotten scoundrel."
"8174146","pervasive","(adj.) spreading or spread throughout","But how did asking ""what's trending?"" become such a pervasive online trend?"
"8174147","cacophonous","(adj.) having an unpleasant sound","The lyrical streets, colorful personalities, and cacophonous eateries are practically extinct."
"8174148","disjointed","(adj.) taken apart at the points of connection","But she did not want too many more of those moments, because they shifted her balance, left her spirit vaguely disjointed."
"8174149","flout","(v.) treat with contemptuous disregard","In an interview on Wisconsin television this week, Ryan said he would not allow Democrats to continue flouting the rules of the House."
"8174150","irascible","(adj.) quickly aroused to anger","If you're irascible, you get angry easily — perhaps blowing up in rage when someone brushes into you."
"8174151","phlegmatic","(adj.) showing little emotion","People who are phlegmatic are just a little dull in expressing feelings or showing emotion."
"8174152","capricious","(adj.) determined by chance or impulse rather than by necessity","Capricious is an adjective to describe a person or thing that's impulsive and unpredictable, like a bride who suddenly leaves her groom standing at the wedding altar."
"8174153","dismiss","(v.) stop associating with","At the end of a lesson period, your teacher says, ""class dismissed."
"8174154","foment","(vt.) try to stir up","Russia has nurtured discord inside the European Union by supporting an array of small, extremist political parties that foment nationalist anger in different countries."
"8174155","irresolute","(adj.) uncertain how to act or proceed","Irresolute describes someone who feels stuck."
"8174156","piety","(n.) righteousness by virtue of being pious","Piety is devotion to God or to religious practices. Nuns who pray all day long are famous for their piety. If you have filial piety it means you're devoted to your parents."
"8174157","castigation","(n.) verbal punishment","If your coach yells at your team for sloppy play, his post-game speech might be called a castigation."
"8174158","disparage","(vt.) express a negative opinion of","If you haven't got anything nice to say, then it's time to disparage someone. It means to belittle or degrade a person or idea."
"8174159","forestall","(vt.) keep from happening or arising; make impossible","To forestall the effects of aging, exercise and take care of your health all your life."
"8174160","itinerary","(n.) an established line of travel or access","An itinerary is your travel plan — where you will go and when you will be there."
"8174161","placate","(vt.) cause to be more favorably inclined","When a husband shows up with flowers after he's fought with his wife, he's trying to placate her."
"8174162","catalyst","(n.) substance that initiates or accelerates a chemical reaction","A catalyst is an event or person causing a change. Getting kicked out of your parents' house might be a catalyst for becoming more independent."
"8174163","disparate","(adj.) fundamentally different or distinct in quality or kind","The trunk of some people's cars may contain items as disparate as old clothes, rotting food, and possibly a missing relative."
"8174164","frugality","(n.) prudence in avoiding waste","If you try to avoid waste by reusing and repurposing items that most people would throw away, your frugality will save you money."
"8174165","laconic","(adj.) brief and to the point","Laconic is an adjective that describes a style of speaking or writing that uses only a few words, often to express complex thoughts and ideas."
"8174166","plasticity","(n.) the property of being physically malleable","Plasticity means ""changeability"" or ""moldability"" — clay has a lot of plasticity, but a rock has almost none."
"8174167","caustic","(adj.)capable of destroying or eating away by chemical action","The lawsuits have, at times, devolved into a war of words, with both sides releasing caustic statements."
"8174168","dissemble","(v.) behave unnaturally or affectedly; to deceive","When confronted about their human rights record, the Chinese government typically dissembles."
"8174169","futile","(adj.) producing no result or effect","Hopefully all the time you're spending studying vocabulary won't turn out to be futile!"
"8174170","lassitude","(n.) a feeling of lack of interest or energy","If you are feeling lassitude, you're weary and just can't be bothered. Couch potatoes make lassitude into an art form"
"8174171","platitude","(n.) a trite or obvious remark","His employees might get sick of listening to these meaningless clichés and tell him to cut the platitudes."
"8174172","plethora","(n.) extreme excess","If you have 15 different people who want to take you on a date, you have a plethora of romantic possibilities."
"8174173","propitiate","(v.) make peace with","If you forgot flowers on your Mom's birthday, you can still propitiate her by sending a bouquet the next day."
"8174174","rescind","(v.) cancel officially","Carter made it known last July that he intended to rescind the ban on transgender service members serving in the military, calling it outdated."
"8174175","sporadic","(adj.) recurring in scattered or unpredictable instances","The mail carrier comes every day but the plumber's visits are sporadic––he comes as needed."
"8174176","tractable","(adj.) easily managed","If your little brother quietly obeys your instructions and waits for you at the food court while you and your friends wander around the mall, he's probably a tractable child, meaning he's obedient, flexible, and responds well to directions."
"8174177","plummet","(v.) drop sharply","The verb plummet means ""to drop sharply, like eagles that plummet toward earth, seeking prey, or school attendance that plummets when there is a flu outbreak."
"8174178","propriety","(n.) correct behavior","If you are someone who cares about always doing the right and proper thing, your friends might accuse you of being obsessed with propriety and beg you to loosen up."
"8174179","resolution","(n.) a decision to do something or to behave in a certain manner","Israeli officials have repeatedly said Arab nations band together to propose resolutions that impact Israel at the U.N."
"8174180","stigma","(n.) a symbol of disgrace or infamy","If something has a negative association attached to it, call this a stigma."
"8174181","transgression","(n.) the violation of a law or a duty or moral principle","Whether you are cheating on a test, or cheating on a spouse, you are committing transgressions that are not easily forgiven."
"8174182","porous","(adj.) full of holes or vessels","A sponge is porous, and if the border between countries is open for anyone to cross easily, it too can be called porous."
"8174183","proscribe","(v.) command against","To proscribe something is to forbid or prohibit it, as a school principal might proscribe the use of cell phones in class."
"8174184","resolve","(vt.) find a solution or answer","A college's board of directors might resolve to recruit more minority students."
"8174185","stint","(n.) supply sparingly and with restricted quantities","The rookie was recalled earlier Sunday from Triple-A Scranton/Wilkes-Barre, his third stint with the big league team this year."
"8174186","truculence","(n.) obstreperous and defiant aggressiveness","If you get into fights all of the time, you might be accused of truculence and sent for anger management classes."
"8174187","pragmatic","(adj.) concerned with practical matters","She has proved to be an effective and pragmatic leader."
"8174188","pungent","(adj.) strong and sharp","Use pungent to describe a taste or smell that gives a sharp sensation. ""The atmosphere was pungent with the odor of stale sweat."""
"8174189","reticent","(adj.) quiet, restrained, reluctant to draw attention to yourself","Reticent means either quiet or restrained. If you're reticent about your feelings, you like to keep them to yourself, and you're probably quiet in rowdy groups where everyone is talking over each other."
"8174190","stipulate","(v.) make an express demand or provision in an agreement","To stipulate something means to demand that it be part of an agreement. When you make a contract or deal, you can stipulate that a certain condition must be met."
"8174191","vacillate","(v.) be undecided about something","You might vacillate between ordering waffles and pancakes at your favorite diner — it’s hard to pick just one when both are so tasty!"
"8174192","preamble","(n.) a brief introduction to a speech or constitution","It seemed clear this circling was the preamble to something worse."
"8174193","reverent","(adj.) feeling or showing profound respect or veneration","When you have great awe and respect for someone or something, and you show it by respectfully worshiping that person, thing, deity, or musical group, you are being reverent."
"8174194","stolid","(adj.) having or revealing little emotion or sensibility","A stolid person can’t be moved to smile or show much sign of life, in much the same way as something solid, like a giant boulder, is immovable."
