"8174195","venerate","(v.) regard with feelings of respect and reverence","Fini said, he wants to call as a witness the Falun Gong’s venerated founder and leader, Li Hongzhi."
"8174196","precarious","(adj.) not secure; beset with difficulties","Grab for the adjective precarious when something is unstable, dangerous or difficult and likely to get worse. Are you totally broke and the people you owe money to keep calling? You're in a precarious financial situation!"
"8174197","quibble","(v.) pick a mini-fight over something that doesn't really matter.","Let's not quibble over price,"" people will say, usually when they plan to gouge you."
"8174198","sage","(n.) a mentor in spiritual and philosophical topics","Thanks to the sage advice of your friend, you didn't write your teacher an angry e-mail!"
"8174199","striate","(v.) mark with stripes","Since planning this Utah vacation, I had been coming across aerial photos of a gooseneck turn in the Colorado River that weaves among striated cliffs."
"8174200","veracious","(adj.) habitually speaking the truth","Someone who is veracious speaks the truth — like your brutally honest friend who always lets you know what she thinks about your outfits, your hairstyle, your lasagna recipe, and your taste in movies."
"8174201","precipitate","(v.) bring about abruptly","Precipitate usually means ""bringing something on"" or ""making it happen"" — and not always in a good way."
"8174202","quiescent","(adj.) being quiet or still or inactive","Sandy enjoys the quiescent moments lying in a hammock on a beautiful summer Sunday."
"8174203","salubrious","(adj.) promoting health; healthful","Salubrious is a fancy way to describe something that’s good for you or is generally favorable to mind or body, but it need not be limited to describing healthy foods or liquids."
"8174204","strut","(v.) to walk with a lofty proud gait","When you strut, you walk with a proud swagger that has a little arrogance thrown in, like the prance of a running back who has just flown past the 250-pound linebackers and planted the ball in the end zone."
"8174205","verbose","(adj.) using or containing too many words","If you're verbose, you use far more words than you need to."
"8174206","precursor","(n.) something indicating the approach of something or someone","Pride is a precursor to the fall."
"8174207","rarefied","(adj.) of high moral or intellectual value","Use the adjective rarefied to describe things that are so stylish, smart, or moral that they seem elevated above the ordinary, like the rarefied conversation of brilliant scholars."
"8174208","sanction","(n.) official permission or approval; the act of punishing","Sanction has two nearly opposite meanings: to sanction can be to approve of something, but it can also mean to punish, or speak harshly to."
"8174209","subpoena","(n.) a writ issued to compel the attendance of a witness","A subpoena is a document that requires its recipient to appear in court as a witness."
"8174210","viable","(adj.) capable of life or normal growth and development","A viable seed can develop into a plant, while a viable company has the resources to succeed."
"8174211","presumptuous","(adj.) excessively forward","While it would be “presumptuous” to agree, “If memory serves, when I started out all color was absent from fashion,” he added."
"8174212","recalcitrant","(adj.) stubbornly resistant to authority or control","Meanwhile, the National Liberation Army, a much smaller but more recalcitrant rebel group, hasn't started peace talks."
"8174213","satiate","(v.) fill to satisfaction","If you just can't get enough popcorn, even the jumbo tub at the movie theater may not be enough to satiate, or satisfy, your desire."
"8174214","subside","(v.) sink to a lower level or form a depression","Now, even as the market panic subsides, Brexit is raising existential questions about London’s future as one of the world’s great financial capitals."
"8174215","viscous","(adj.) having a relatively high resistance to flow","If something is viscous, you usually don't want to stick your fingers in it — that goes for boogers and maple syrup alike."
"8174216","prevaricate","(v.) be deliberately ambiguous or unclear","When you prevaricate, you lie or mislead."
"8174217","recant","(v.) formally reject or disavow a formerly held belief","He recanted within hours, saying that doctors who perform abortions should be held legally responsible;"
"8174218","saturate","(v.) infuse or fill completely","A heavy rainstorm can saturate the ground, leaving puddles on the lawn because no more water can be absorbed."
"8174219","substantiate","(v.) establish or strengthen as with new evidence or facts","We’d really like to believe in the Tooth Fairy; however, more evidence is needed to substantiate her existence (besides that quarter in your pocket)."
"8174220","vituperative","(adj.) marked by harshly abusive criticism","Use the adjective vituperative to describe criticism that's so sharp it hurts."
"8174221","pristine","(adj.) immaculately clean and unused","Please check your shoes before walking on a pristine white carpet..."
"8174222","recluse","(n.) one who lives in solitude","Dickinson is often portrayed as some white gossamer recluse, completely divorced from the world outside her bedroom—but that is not really true."
"8174223","savor","(v.) the taste experience when a savoury condiment is tasted","Whether it’s a feeling of joy or a piece of pecan pie — when you savor something, you enjoy it to the fullest."
"8174224","supercede","(v.) take the place or move into the position of","And the Supreme Court has held that national-party rules supercede State laws."
"8174225","volatile","(adj.) liable to lead to sudden change or violence","Watch out when a situation becomes volatile — it is likely to change for the worse suddenly."
"8174226","probity","(n.) complete and confirmed integrity","I am a model of probity and people find my presence reassuring."
"8174227","recondite","(adj.) difficult to penetrate; incomprehensible to one of ordinary understanding or knowledge","Then again, it was impressive to witness the intense interest that this recondite author still arouses."
"8174228","secrete","(vt.) generate and separate from cells or bodily fluids","When you squeeze a lemon, it secretes juice."
"8174229","supposition","(n.) a guess or hypothesis","Your supposition that your kids will automatically wash their hands before dinner is probably false. You'd best remind them to do it or risk dirty hands at dinner."
"8174230","unwarranted","(adj.) incapable of being justified or explained","He singled out major research hospitals for poor collaboration and drug companies for unwarranted price hikes."
"8174231","problematic","(adj.) making great mental demands","Metro station design and function will continue to be problematic."
"8174232","refractory","(adj.) stubbornly resistant to authority or control","The dog is refractory, or stubbornly resisting your authority."
"8174233","shard","(n.) a broken piece of a brittle artifact","If you break a mirror, the thin sharp pieces you want to avoid are shards."
"8174234","tacit","(adj.) implied by or inferred from actions or statements","Something tacit is implied or understood without question. Holding hands might be a tacit acknowledgment that a boy and girl are dating."
"8174235","wary","(adj.) marked by keen caution and watchful prudence","Be wary of risky things like wild mushrooms and Internet deals!"
"8174236","prodigal","(adj.) recklessly wasteful","Use the adjective prodigal to describe someone who spends too much money, or something very wasteful."
"8174237","refute","(v.) overthrow by argument, evidence, or proof","When the kids you're babysitting swear they brushed their teeth, you can refute their claim by presenting the dry toothbrushes."
"8174238","skeptic","(n.) someone who habitually doubts accepted beliefs","A skeptic is a doubter. The guy who's ready to poke holes in the most brilliant argument you've ever made."
"8174239","tangential","(adj.) of superficial relevance if any","Granot said African countries may be responsive to supporting Israel because the Palestinian cause is ""tangential"" to them."
"8174240","welter","(n.) a confused multitude of things","Use the noun welter to describe an enormous, messy pile, like the jumble of papers, coffee mugs, pens, and food wrappers on the desk of the messiest person in the office."
"8174241","relegate","(v.) assign to a lower position","If the quarterback of the football team stops making decent throws he might be relegated to the position of benchwarmer, while another kid is given the chance to play."
"8174242","tenuous","(adj.) very thin in gauge or diameter","If you try to learn a complicated mathematical concept by cramming for 45 minutes, you will have a tenuous grasp of that concept, at best."
"8174243","prohibitive","(adj.) tending to discourage, especially of prices","If something's so expensive you can't touch it, it's prohibitive. That Ferrari in the showroom? You may want it, but its price is prohibitive."
"8174244","reproach","(n.) mildly criticize","If you show poor manners at your grandmother's dinner table, she will reproach you."
"8174245","soporific","(adj.) sleep inducing","Certain medicines, but also extreme coziness, can have a soporific effect."
"8174246","tirade","(n.) a speech of violent denunciation","A BBC presenter is moved to tears as she describes the racist tirade she faced in Coventry city centre."
"8174247","zealot","(n.) a fervent and even militant proponent of something","The hamburger zealot was so fanatical about his burgers that he camped outside his favorite fast-food joint for hours every morning, waiting for it to open."
"8174248","proliferate","(v.) grow rapidly","Bunny rabbits have a habit of proliferating, as do dandelions in untended gardens and funny YouTube videos on the internet."
"8174249","reprobate","(n.) a person without moral scruples","There's no way around it, a reprobate is a bad egg."
"8174250","specious","(adj.) plausible but false","Use specious to describe an argument that seems to be good, correct, or logical, but is not so."
"8174251","torpor","(n.) a state of motor and mental inactivity","After a huge Thanksgiving meal, my family members fall into a torpor; no one can even pick up the TV remote."
"8174252","propensity","(n.) a natural inclination","It is well documented that Bill Clinton has a propensity for being social when he sees someone he knows in public."
"8174253","repudiate","(vt.) refuse to acknowledge, ratify, or recognize as valid","At a campaign event in Pittsburgh, Clinton excoriated Trump and challenged Republicans to repudiate him."
"8174254","spectrum","(n.) a broad range of related objects or values or qualities","There is a wide spectrum of political beliefs in this country, ranging from super conservative to uber-liberal and everything in between."
"8174255","tortuous","(adj.) marked by repeated turns and bends","James Bond drove his custom BMW 120 mph on the road that was tortuous in its twists and turns."
"8174256","discrete","(adj.) constituting a separate entity or part","As her friend drove off, O’Keefe moved her Mustang, which had been parked under a light, to a more discrete spot."
"8174257","qualified","(adj.) meeting the proper standards or requirements for a task","Its hard cheeses are handcrafted in open vats by qualified cheesemakers, not machines."
"8174258","inured","(adj.) made tough by habitual exposure","If you have gotten so many mosquito bites in your life that they no longer bother you, you have become inured to them."
"8174259","whimsical","(adj.) determined by chance or impulse rather than by necessity","This album was largely whimsical and retrospective, with a subtle sense of humour, even through the more serious numbers."
"8174260","solicitous","(adj.) full of anxiety and concern","When you hear the word solicitous, think of your mom — attentive, caring, and concerned."
